Title,Price,Availability,Star Rating,Description,Category
An Abundance of Katherines,£10.00,In stock (5 available),5,"Katherine V thought boys were gross Katherine X just wanted to be friends Katherine XVIII dumped him in an e-mail K-19 broke his heart When it comes to relationships, Colin Singleton's type happens to be girls named Katherine. And when it comes to girls named Katherine, Colin is always getting dumped. Nineteen times, to be exact. On a road trip miles from home, this anagr Katherine V thought boys were gross Katherine X just wanted to be friends Katherine XVIII dumped him in an e-mail K-19 broke his heart When it comes to relationships, Colin Singleton's type happens to be girls named Katherine. And when it comes to girls named Katherine, Colin is always getting dumped. Nineteen times, to be exact. On a road trip miles from home, this anagram-happy, washed-up child prodigy has ten thousand dollars in his pocket, a bloodthirsty feral hog on his trail, and an overweight, Judge Judy-loving best friend riding shotgun--but no Katherines. Colin is on a mission to prove The Theorem of Underlying Katherine Predictability, which he hopes will predict the future of any relationship, avenge Dumpees everywhere, and finally win him the girl. Love, friendship, and a dead Austro-Hungarian archduke add up to surprising and heart-changing conclusions in this ingeniously layered comic novel about reinventing oneself. ...more",Young Adult
Harry Potter and the Prisoner of Azkaban (Harry Potter #3),£24.17,In stock (4 available),4,"Harry Potter is lucky to reach the age of thirteen, since he has already survived the murderous attacks of the feared Dark Lord on more than one occasion. But his hopes for a quiet term concentrating on Quidditch are dashed when a maniacal mass-murderer escapes from Azkaban, pursued by the soul-sucking Dementors who guard the prison. It's assumed that Hogwarts is the safes Harry Potter is lucky to reach the age of thirteen, since he has already survived the murderous attacks of the feared Dark Lord on more than one occasion. But his hopes for a quiet term concentrating on Quidditch are dashed when a maniacal mass-murderer escapes from Azkaban, pursued by the soul-sucking Dementors who guard the prison. It's assumed that Hogwarts is the safest place for Harry to be. But is it a coincidence that he can feel eyes watching him in the dark, and should he be taking Professor Trelawney's ghoulish predictions seriously? ...more",Young Adult
"The Land of 10,000 Madonnas",£29.64,In stock (3 available),4,"Five teens backpack through Europe to fulfill the mysterious dying wish of their friend.Jesse lives with his history professor dad in a house covered with postcards of images of the Madonna from all over the world. They’re gotten used to this life: two motherless dudes living among thousands of Madonnas. But Jesse has a heart condition that will ultimately cut his life tra Five teens backpack through Europe to fulfill the mysterious dying wish of their friend.Jesse lives with his history professor dad in a house covered with postcards of images of the Madonna from all over the world. They’re gotten used to this life: two motherless dudes living among thousands of Madonnas. But Jesse has a heart condition that will ultimately cut his life tragically short. Before he dies, he arranges a mysterious trip to Europe for his three cousins, his best friend, and his girlfriend to take after he passes away. It’s a trip that will forever change the lives of these young teens and one that will help them come to terms with Jesse’s death. ...more",Young Adult
Scarlet (The Lunar Chronicles #2),£14.57,In stock (3 available),4,"Cinder, the cyborg mechanic, returns in the second thrilling installment of the bestselling Lunar Chronicles. She’s trying to break out of prison—even though if she succeeds, she’ll be the Commonwealth’s most wanted fugitive. Halfway around the world, Scarlet Benoit’s grandmother is missing. It turns out there are many things Scarlet doesn’t know about her grandmother or t Cinder, the cyborg mechanic, returns in the second thrilling installment of the bestselling Lunar Chronicles. She’s trying to break out of prison—even though if she succeeds, she’ll be the Commonwealth’s most wanted fugitive. Halfway around the world, Scarlet Benoit’s grandmother is missing. It turns out there are many things Scarlet doesn’t know about her grandmother or the grave danger she has lived in her whole life. When Scarlet encounters Wolf, a street fighter who may have information as to her grandmother’s whereabouts, she is loath to trust this stranger, but is inexplicably drawn to him, and he to her. As Scarlet and Wolf unravel one mystery, they encounter another when they meet Cinder. Now, all of them must stay one step ahead of the vicious Lunar Queen Levana, who will do anything for the handsome Prince Kai to become her husband, her king, her prisoner. ...more",Young Adult
Legend (Legend #1),£43.69,In stock (3 available),4,"There is an alternate cover edition for this ISBN13 here.What was once the western United States is now home to the Republic, a nation perpetually at war with its neighbors. Born into an elite family in one of the Republic's wealthiest districts, fifteen-year-old June is a prodigy being groomed for success in the Republic's highest military circles. Born into the slums, fi There is an alternate cover edition for this ISBN13 here.What was once the western United States is now home to the Republic, a nation perpetually at war with its neighbors. Born into an elite family in one of the Republic's wealthiest districts, fifteen-year-old June is a prodigy being groomed for success in the Republic's highest military circles. Born into the slums, fifteen-year-old Day is the country's most wanted criminal. But his motives may not be as malicious as they seem.From very different worlds, June and Day have no reason to cross paths—until the day June's brother, Metias, is murdered and Day becomes the prime suspect. Caught in the ultimate game of cat and mouse, Day is in a race for his family's survival, while June seeks to avenge Metias's death. But in a shocking turn of events, the two uncover the truth of what has really brought them together, and the sinister lengths their country will go to keep its secrets. ...more",Young Adult
Lady Renegades (Rebel Belle #3),£53.04,In stock (3 available),5,"Just as Harper Price starts coming to terms with her role as David Stark’s battle-ready Paladin, protector, and girlfriend—her world goes crazy all over again.Overwhelmed by his Oracle powers, David flees Pine Grove and starts turning teenage girls into Paladins—and these young ladies seem to think that Harper is the enemy David needs protecting from. Ordinarily, Harper wo Just as Harper Price starts coming to terms with her role as David Stark’s battle-ready Paladin, protector, and girlfriend—her world goes crazy all over again.Overwhelmed by his Oracle powers, David flees Pine Grove and starts turning teenage girls into Paladins—and these young ladies seem to think that Harper is the enemy David needs protecting from.  Ordinarily, Harper would be able to fight off any Paladin who comes her way, but her powers have been dwindling since David left town…which means her life is on the line yet again.New York Times bestselling author Rachel Hawkins brings the fun once again in the finale of this pitch-perfect romantic paranormal comedy series. ...more",Young Adult
Golden (Heart of Dread #3),£42.21,In stock (3 available),4,"The action-packed finale to the Heart of Dread seriesIn this epic conclusion to the trilogy, Nat and Wes go on a journey to find the Rift, save the source of magic and defeat the Drau, the pirates, and the RSA—but at a great sacrifice. Wes is dying, and as he's rotting the Drau will let the rot ""cleanse"" the source of magic, dooming Wes forever. Nat and Wes discover that t The action-packed finale to the Heart of Dread seriesIn this epic conclusion to the trilogy, Nat and Wes go on a journey to find the Rift, save the source of magic and defeat the Drau, the pirates, and the RSA—but at a great sacrifice. Wes is dying, and as he's rotting the Drau will let the rot ""cleanse"" the source of magic, dooming Wes forever. Nat and Wes discover that the source of the magic lies in the Drakon—the key to the Blue, the protector, the soul of the world. But in order to close the Rift, a great sacrifice is needed. In the words of the sylphs, death is life, and now the worlds can be reborn again.   ...more",Young Adult
Annie on My Mind,£36.83,In stock (3 available),5,"This groundbreaking book is the story of two teenage girls whose friendship blossoms into love and who, despite pressures from family and school that threaten their relationship, promise to be true to each other and their feelings. This book is so truthful and honest, it has been banned from many school libraries and even publicly burned in Kansas City.Of the author and th This groundbreaking book is the story of two teenage girls whose friendship blossoms into love and who, despite pressures from family and school that threaten their relationship, promise to be true to each other and their feelings. This book is so truthful and honest, it has been banned from many school libraries and even publicly burned in Kansas City. Of the author and the book, the Margaret A. Edwards Award committee said, “Nancy Garden has the distinction of being the first author for young adults to create a lesbian love story with a positive ending. Using a fluid, readable style, Garden opens a window through which readers can find courage to be true to themselves.” ...more",Young Adult
New Moon (Twilight #2),£12.86,In stock (2 available),4,"Also see: Alternate Cover Editions for this ISBN [ACE] ACE #1 I knew we were both in mortal danger. Still, in that instant, I felt well. Whole. I could feel my heart racing in my chest, the blood pulsing hot and fast through my veins again. My lungs filled deep with the sweet scent that came off his skin. It was like there had never been any hole in my chest. I was perfe Also see: Alternate Cover Editions for this ISBN [ACE] ACE #1 I knew we were both in mortal danger. Still, in that instant, I felt well. Whole. I could feel my heart racing in my chest, the blood pulsing hot and fast through my veins again. My lungs filled deep with the sweet scent that came off his skin. It was like there had never been any hole in my chest. I was perfect - not healed, but as if there had never been a wound in the first place.LEGIONS OF READERS ARE HUNGRY FOR MORE. GIVE IN TO TEMPTATION... ...more",Young Adult
The Haters,£27.89,In stock (1 available),5,"From Jesse Andrews, author of the New York Times bestselling Me and Earl and the Dying Girl and screenwriter of the Sundance award–winning motion picture of the same name, comes a groundbreaking young adult novel about music, love, friendship, and freedom as three young musicians follow a quest to escape the law long enough to play the amazing show they hope (but also doub From Jesse Andrews, author of the New York Times bestselling Me and Earl and the Dying Girl and screenwriter of the Sundance award–winning motion picture of the same name, comes a groundbreaking young adult novel about music, love, friendship, and freedom as three young musicians follow a quest to escape the law long enough to play the amazing show they hope (but also doubt) they have in them.Inspired by the years he spent playing bass in a band himself, The Haters is Jesse Andrews’s road trip adventure about a trio of jazz-camp escapees who, against every realistic expectation, become a band. For Wes and his best friend, Corey, jazz camp turns out to be lame. It’s pretty much all dudes talking in Jazz Voice. But then they jam with Ash, a charismatic girl with an unusual sound, and the three just click. It’s three and a half hours of pure musical magic, and Ash makes a decision: They need to hit the road. Because the road, not summer camp, is where bands get good. Before Wes and Corey know it, they’re in Ash’s SUV heading south, and The Haters Summer of Hate Tour has begun.In his second novel, Andrews again brings his brilliant and distinctive voice to YA, in the perfect book for music lovers, fans of The Commitments and High Fidelity, or anyone who has ever loved—and hated—a song or a band. This witty, funny coming-of-age novel is contemporary fiction at its best. ...more",Young Adult
The Art of Not Breathing,£40.83,In stock (1 available),4,"Since her twin brother, Eddie, drowned five years ago, sixteen-year-old Elsie Main has tried to remember what really happened that fateful day on the beach. One minute Eddie was there, and the next he was gone. Seventeen-year-old Tay McKenzie is a cute and mysterious boy that Elsie meets in her favorite boathouse hangout. When Tay introduces Elsie to the world of freedivin Since her twin brother, Eddie, drowned five years ago, sixteen-year-old Elsie Main has tried to remember what really happened that fateful day on the beach. One minute Eddie was there, and the next he was gone. Seventeen-year-old Tay McKenzie is a cute and mysterious boy that Elsie meets in her favorite boathouse hangout. When Tay introduces Elsie to the world of freediving, she vows to find the answers she seeks at the bottom of the sea. ...more",Young Adult
The Secret Garden,£15.08,In stock (5 available),4,"When orphaned Mary Lennox comes to live at her uncle's great house on the Yorkshire Moors, she finds it full of secrets. The mansion has nearly one hundred rooms, and her uncle keeps himself locked up. And at night, she hears the sound of crying down one of the long corridors.The gardens surrounding the large property are Mary's only escape. Then, Mary discovers a secret g When orphaned Mary Lennox comes to live at her uncle's great house on the Yorkshire Moors, she finds it full of secrets. The mansion has nearly one hundred rooms, and her uncle keeps himself locked up. And at night, she hears the sound of crying down one of the long corridors.The gardens surrounding the large property are Mary's only escape. Then, Mary discovers a secret garden, surrounded by walls and locked with a missing key. One day, with the help of two unexpected companions, she discovers a way in. Is everything in the garden dead, or can Mary bring it back to life? ...more",Classics
Little Women (Little Women #1),£28.07,In stock (4 available),4,"Little Women is the heartwarming story of the March family that has thrilled generations of readers. It is the story of four sisters--Jo, Meg, Amy and Beth-- and of the courage, humor and ingenuity they display to survive poverty and the absence of their father during the Civil War.",Classics
The Complete Stories and Poems (The Works of Edgar Allan Poe [Cameo Edition]),£26.78,In stock (3 available),4,"This single volume brings together all of Poe's stories and poems, and illuminates the diverse and multifaceted genius of one of the greatest and most influential figures in American literary history.",Classics
The Story of Hong Gildong,£43.19,In stock (1 available),4,"The Story of Hong Gildong is arguably the single most important work of classic Korean fiction. Like its English counterpart, Robin Hood, it has been adapted into countless movies, television shows, novels and comics. Its memorable lines are known to virtually every Korean by heart. Until now, this incredible 19th century fable has been all but inaccessible to English read The Story of Hong Gildong is arguably the single most important work of classic Korean fiction. Like its English counterpart, Robin Hood, it has been adapted into countless movies, television shows, novels and comics. Its memorable lines are known to virtually every Korean by heart. Until now, this incredible 19th century fable has been all but inaccessible to English readers.Hong Gildong, the brilliant but illegitimate son of a government minister, cannot advance in society due to his secondary status, so he leaves home to become the leader of a band of outlaws who rob the rich to give to the poor. On the way to building his own empire and gaining acceptance from his family, Hong Gildong vanquishes assassins, battles monsters, and conquers kingdoms. Minsoo Kang's expressive and animated new translation finally makes the original text of this classic available in English, re-introducing a noble and righteous outlaw and sharing a beloved hallmark of Korean culture. ...more",Classics
You Are What You Love: The Spiritual Power of Habit,£21.87,In stock (15 available),4,"You are what you love. But you might not love what you think.In this book, award-winning author James K. A. Smith shows that who and what we worship fundamentally shape our hearts. And while we desire to shape culture, we are not often aware of how culture shapes us. We might not realize the ways our hearts are being taught to love rival gods instead of the One for whom we You are what you love. But you might not love what you think.In this book, award-winning author James K. A. Smith shows that who and what we worship fundamentally shape our hearts. And while we desire to shape culture, we are not often aware of how culture shapes us. We might not realize the ways our hearts are being taught to love rival gods instead of the One for whom we were made. Smith helps readers recognize the formative power of culture and the transformative possibilities of Christian practices. He explains that worship is the ""imagination station"" that incubates our loves and longings so that our cultural endeavors are indexed toward God and his kingdom. This is why the church and worshiping in a local community of believers should be the hub and heart of Christian formation and discipleship.Following the publication of his influential work Desiring the Kingdom, Smith received numerous requests from pastors and leaders for a more accessible version of that book's content. No mere abridgment, this new book draws on years of Smith's popular presentations on the ideas presented in Desiring the Kingdom to offer a fresh, bottom-up rearticulation. The author creatively uses film, literature, and music illustrations to engage readers and includes material on marriage, family, youth ministry, and faith and work. He also suggests individual and communal practices for shaping the Christian life. ...more",Religion
