Title,Price,Availability,Star Rating,Description,Category
Set Me Free,£17.46,In stock (19 available),5,"Aaron Ledbetter’s future had been planned out for him since before he was born. Each year, the Ledbetter family vacation on Tybee Island gave Aaron a chance to briefly free himself from his family’s expectations. When he meets Jonas “Lucky” Luckett, a caricature artist in town with the traveling carnival, he must choose between the life that’s been mapped out for him, and Aaron Ledbetter’s future had been planned out for him since before he was born. Each year, the Ledbetter family vacation on Tybee Island gave Aaron a chance to briefly free himself from his family’s expectations. When he meets Jonas “Lucky” Luckett, a caricature artist in town with the traveling carnival, he must choose between the life that’s been mapped out for him, and the chance at true love. ...more",Young Adult
A Fierce and Subtle Poison,£28.13,In stock (16 available),4,"Everyone knows the legends about the cursed girl--Isabel, the one the señoras whisper about. They say she has green skin and grass for hair, and she feeds on the poisonous plants that fill her family’s Caribbean island garden. Some say she can grant wishes; some say her touch can kill.Seventeen-year-old Lucas lives on the mainland most of the year but spends summers with h Everyone knows the legends about the cursed girl--Isabel, the one the señoras whisper about. They say she has green skin and grass for hair, and she feeds on the poisonous plants that fill her family’s Caribbean island garden. Some say she can grant wishes; some say her touch can kill.Seventeen-year-old Lucas lives on the mainland most of the year but spends summers with his hotel-developer father in Puerto Rico. He’s grown up hearing stories about the cursed girl, and he wants to believe in Isabel and her magic. When letters from Isabel begin mysteriously appearing in his room the same day his new girlfriend disappears, Lucas turns to Isabel for answers--and finds himself lured into her strange and enchanted world. But time is running out for the girl filled with poison, and the more entangled Lucas becomes with Isabel, the less certain he is of escaping with his own life. ...more",Young Adult
Scarlett Epstein Hates It Here,£43.55,In stock (15 available),5,"Meet Scarlett Epstein, BNF (Big Name Fan) in her online community of fanfiction writers, world-class nobody at Melville High. Her best (read: only) IRL friends are Avery, a painfully shy and annoyingly attractive bookworm, and Ruth, her weed-smoking, possibly insane seventy-three-year-old neighbor.When Scarlett’s beloved TV show is canceled and her longtime crush, Gideon, Meet Scarlett Epstein, BNF (Big Name Fan) in her online community of fanfiction writers, world-class nobody at Melville High. Her best (read: only) IRL friends are Avery, a painfully shy and annoyingly attractive bookworm, and Ruth, her weed-smoking, possibly insane seventy-three-year-old neighbor.When Scarlett’s beloved TV show is canceled and her longtime crush, Gideon, is sucked out of her orbit and into the dark and distant world of Populars, Scarlett turns to the fanfic message boards for comfort. This time, though, her subjects aren’t the swoon-worthy stars of her fave series—they’re the real-life kids from her high school. And if they ever find out what Scarlett truly thinks about them, she’ll be thrust into a situation far more dramatic than anything she’s ever seen on TV… ...more",Young Adult
Library of Souls (Miss Peregrine’s Peculiar Children #3),£48.56,In stock (15 available),5,"A boy with extraordinary powers. An army of deadly monsters. An epic battle for the future of peculiardom.The adventure that began with Miss Peregrine’s Home for Peculiar Children and continued in Hollow City comes to a thrilling conclusion with Library of Souls. As the story opens, sixteen-year-old Jacob discovers a powerful new ability, and soon he’s diving through histo A boy with extraordinary powers. An army of deadly monsters. An epic battle for the future of peculiardom.The adventure that began with Miss Peregrine’s Home for Peculiar Children and continued in Hollow City comes to a thrilling conclusion with Library of Souls. As the story opens, sixteen-year-old Jacob discovers a powerful new ability, and soon he’s diving through history to rescue his peculiar companions from a heavily guarded fortress. Accompanying Jacob on his journey are Emma Bloom, a girl with fire at her fingertips, and Addison MacHenry, a dog with a nose for sniffing out lost children.They’ll travel from modern-day London to the labyrinthine alleys of Devil’s Acre, the most wretched slum in all of Victorian England. It’s a place where the fate of peculiar children everywhere will be decided once and for all. Like its predecessors, Library of Souls blends thrilling fantasy with never-before-published vintage photography to create a one-of-a-kind reading experience. ...more",Young Adult
Frostbite (Vampire Academy #2),£29.99,In stock (15 available),5,"WHEN LOVE AND JEALOUSY COLLIDE ON THE SLOPES, WINTER BREAK TURNS DEADLY...Lissa Dragomir is a Moroi princess: a mortal vampire with a rare gift for harnessing the earth's magic. She must be protected at all times from Strigoi; the fiercest vampires - the ones who never die. The powerful blend of human and vampire blood that flows through Rose Hathaway, Lissa's best friend, WHEN LOVE AND JEALOUSY COLLIDE ON THE SLOPES, WINTER BREAK TURNS DEADLY...Lissa Dragomir is a Moroi princess: a mortal vampire with a rare gift for harnessing the earth's magic. She must be protected at all times from Strigoi; the fiercest vampires - the ones who never die. The powerful blend of human and vampire blood that flows through Rose Hathaway, Lissa's best friend, makes her a dhampir. Rose is dedicated to a dangerous life of protecting Lissa from the Strigoi, who are hell-bent on making Lissa one of them.Rose has serious guy trouble. Her gorgeous tutor, Dimitri, has his eye on someone else, her friend Mason has a huge crush on her, and she keeps getting stuck in her best friend Lissa's head while she's making out with her boyfriend, Christian.Then a nearby Strigoi attack puts St. Vladimir's on high alert, and the Academy whisks its students away on a mandatory holiday ski trip. But the glittering winter landscape and posh Idaho resort only provide the illusion of safety. When three students run away to strike back against the deadly Strigoi, Rose must join forces with Christian to rescue them. Only this time, Rose - and her heart - are in more danger than she ever could have imagined... ...more",Young Adult
The Darkest Lie,£35.35,In stock (14 available),5,"“The mother I knew would never do those things.But maybe I never knew her after all.”Clothes, jokes, coded messages…Cecilia Brooks and her mom shared everything. At least, CeCe thought they did. Six months ago, her mom killed herself after accusations of having sex with a student, and CeCe’s been the subject of whispers and taunts ever since. Now, at the start of her high “The mother I knew would never do those things.But maybe I never knew her after all.”Clothes, jokes, coded messages…Cecilia Brooks and her mom shared everything. At least, CeCe thought they did. Six months ago, her mom killed herself after accusations of having sex with a student, and CeCe’s been the subject of whispers and taunts ever since. Now, at the start of her high school senior year, between dealing with her grieving, distracted father, and the social nightmare that has become her life, CeCe just wants to fly under the radar. Instead, she’s volunteering at the school’s crisis hotline—the same place her mother worked.As she counsels troubled strangers, CeCe’s lingering suspicions about her mom’s death surface. With the help of Sam, a new student and newspaper intern, she starts to piece together fragmented clues that point to a twisted secret at the heart of her community. Soon, finding the truth isn’t just a matter of restoring her mother’s reputation, it’s about saving lives—including CeCe’s own… ...more",Young Adult
Aristotle and Dante Discover the Secrets of the Universe (Aristotle and Dante Discover the Secrets of the Universe #1),£58.14,In stock (14 available),4,"This Printz Honor Book is a “tender, honest exploration of identity” (Publishers Weekly) that distills lyrical truths about family and friendship.Aristotle is an angry teen with a brother in prison. Dante is a know-it-all who has an unusual way of looking at the world. When the two meet at the swimming pool, they seem to have nothing in common. But as the loners start spen This Printz Honor Book is a “tender, honest exploration of identity” (Publishers Weekly) that distills lyrical truths about family and friendship.Aristotle is an angry teen with a brother in prison. Dante is a know-it-all who has an unusual way of looking at the world. When the two meet at the swimming pool, they seem to have nothing in common. But as the loners start spending time together, they discover that they share a special friendship—the kind that changes lives and lasts a lifetime. And it is through this friendship that Ari and Dante will learn the most important truths about themselves and the kind of people they want to be. ...more",Young Adult
The Epidemic (The Program 0.6),£14.44,In stock (12 available),5,"Can one girl help others find closure by slipping into the identities of their loved ones? Find out in this riveting sequel to The Remedy and companion to the New York Times bestselling The Treatment and The Program.In a world before The Program…Quinlan McKee has spent her life acting as other people. She was a closer—a person hired to play the role of the recently decease Can one girl help others find closure by slipping into the identities of their loved ones? Find out in this riveting sequel to The Remedy and companion to the New York Times bestselling The Treatment and The Program.In a world before The Program…Quinlan McKee has spent her life acting as other people. She was a closer—a person hired to play the role of the recently deceased in order to give their families closure. Through this process, Quinn learned to read people and situations, even losing a bit of herself to do so. But she couldn’t have guessed how her last case would bring down her entire world.The only person Quinn trusts is Deacon, her best friend and the love of her life. Except Deacon’s been keeping secrets of his one, so Quinn must set out alone to find Arthur Pritchard, the doctor who’s been trying to control her life. The journey brings Quinn to Arthur’s daughter, Virginia, who tells Quinn the truth about Pritchard’s motives. The former closer will start to see that she is the first step in fighting an epidemic.But Quinlan doesn’t want to be a cure. And with all the lies surrounding her, she realizes she has no one left to rely on but herself—even if she doesn’t know who that is anymore. ...more",Young Adult
No Love Allowed (Dodge Cove #1),£54.65,In stock (12 available),4,"It's all fun and parties until someone falls in love in this modern fairy tale from author Kate Evangelista.Caleb desperately needs a fake girlfriend. Either he attends a series of parties for his father’s law firm with a pretty girl on his arm, or he gets shipped off to Yale to start a future he’s not ready for and isn’t sure he wants. And sadly, the last unattached girl It's all fun and parties until someone falls in love in this modern fairy tale from author Kate Evangelista.Caleb desperately needs a fake girlfriend. Either he attends a series of parties for his father’s law firm with a pretty girl on his arm, or he gets shipped off to Yale to start a future he’s not ready for and isn’t sure he wants. And sadly, the last unattached girl in his social circle has just made the grievous mistake of falling in love with him. Fortunately, Didi, recently fired waitress and aspiring painter, is open to new experiences. As the summer ticks by in a whirl of lavish parties, there’s only one rule: They must not fall in love! ...more",Young Adult
"Exit, Pursued by a Bear",£51.34,In stock (11 available),4,"“I love you,” Polly says suddenly when I’m almost to the door.“I know,” I say.Hermione Winters has been a flyer. She’s been captain of her cheerleading team. The envied girlfriend and the undisputed queen of her school. Now it’s her last year and those days and those labels are fading fast. In a few months she’ll be a different person. She thinks she’s ready for whatever c “I love you,” Polly says suddenly when I’m almost to the door.“I know,” I say.Hermione Winters has been a flyer. She’s been captain of her cheerleading team. The envied girlfriend and the undisputed queen of her school. Now it’s her last year and those days and those labels are fading fast. In a few months she’ll be a different person. She thinks she’s ready for whatever comes next.But then someone puts something in her drink at a party, and in an instant she finds herself wearing new labels, ones she never imagined:Victim. Survivor. That raped girl.Even though this was never the future she imagined, one essential thing remains unchanged: Hermione can still call herself Polly Olivier’s best friend, and that may be the truest label of all.Heartbreaking and empowering, Exit, Pursued by a Bear is the story of transcendent friendship in the face of trauma.“I love you,” I say, because I really, really do.“I know,” says Polly. ...more",Young Adult
My Life Next Door (My Life Next Door ),£36.39,In stock (8 available),5,"""One thing my mother never knew, and would disapprove of most of all, was that I watched the Garretts. All the time.""The Garretts are everything the Reeds are not. Loud, messy, affectionate. And every day from her rooftop perch, Samantha Reed wishes she was one of them . . . until one summer evening, Jase Garrett climbs up next to her and changes everything.As the two fall ""One thing my mother never knew, and would disapprove of most of all, was that I watched the Garretts. All the time.""The Garretts are everything the Reeds are not. Loud, messy, affectionate. And every day from her rooftop perch, Samantha Reed wishes she was one of them . . . until one summer evening, Jase Garrett climbs up next to her and changes everything.As the two fall fiercely for each other, stumbling through the awkwardness and awesomeness of first love, Jase's family embraces Samantha - even as she keeps him a secret from her own. Then something unthinkable happens, and the bottom drops out of Samantha's world. She's suddenly faced with an impossible decision. Which perfect family will save her? Or is it time she saved herself?A transporting debut about family, friendship, first romance, and how to be true to one person you love without betraying another. ...more",Young Adult
Future Shock (Future Shock #1),£55.65,In stock (8 available),5,"What do you do when the future is too late, and the present is counting down to an inevitable moment?Elena Martinez has street smarts, the ability for perfect recall, and a deadline: if she doesn’t find a job before she turns eighteen, she’ll be homeless. But then she gets an unexpected offer from Aether Corporation, the powerful Los Angeles tech giant. Along with four oth What do you do when the future is too late, and the present is counting down to an inevitable moment?Elena Martinez has street smarts, the ability for perfect recall, and a deadline: if she doesn’t find a job before she turns eighteen, she’ll be homeless. But then she gets an unexpected offer from Aether Corporation, the powerful Los Angeles tech giant. Along with four other recruits—Adam, Chris, Trent, and Zoe—Elena is being sent on a secret mission to bring back data from the future. All they have to do is get Aether the information they need, and the five of them will be set for life. It’s an offer Elena can’t refuse.But something goes wrong when the time travelers arrive in the future. And they are forced to break the only rule they were given—not to look into their own fates. Now they have twenty-four hours to get back to the present and find a way to stop a seemingly inevitable future—and a murder—from happening. But changing the timeline has deadly consequences too. Who can Elena trust as she fights to save her life?The first book in an unforgettable series about rewriting your destiny in the city of dreams. ...more",Young Adult
Nightstruck: A Novel,£50.35,In stock (7 available),4,"It starts with a cry in the night.Becket, walking her dog one winter evening, fears it’s an abandoned baby left out in the cold. But it is something else—something evil—and it tricks Becket into opening a doorway to another realm, letting a darkness into our world, a corruption that begins transforming Philadelphia into a sinister and menacing version of itself…but only at It starts with a cry in the night.Becket, walking her dog one winter evening, fears it’s an abandoned baby left out in the cold. But it is something else—something evil—and it tricks Becket into opening a doorway to another realm, letting a darkness into our world, a corruption that begins transforming Philadelphia into a sinister and menacing version of itself…but only at night.The changes are subtle at first, causing Becket to doubt her senses and her sanity. But soon the nightmarish truth is impossible to deny: By day, the city is just a city, but at night it literally comes alive with malevolent purpose. Brick and steel become bone, streetlights turn into gallows, and hungry alleys wait to snare mortal victims. Terrified citizens huddle indoors after dusk, as others succumb to the siren song of the night, letting their darker sides run wild.Once, Becket’s biggest problems were living up to her police commissioner father’s high expectations and a secret crush on her best friend’s boyfriend. Now she must find a way to survive and protect her loved ones…before the darkness takes her as well. ...more",Young Adult
"Will Grayson, Will Grayson (Will Grayson, Will Grayson)",£47.31,In stock (5 available),4,"Will Grayson meets Will Grayson. One cold night, in a most unlikely corner of Chicago, two strangers are about to cross paths. From that moment on, their world will collide and lives intertwine.It's not that far from Evanston to Naperville, but Chicago suburbanites Will Grayson and Will Grayson might as well live on different planets. When fate delivers them both to the sa Will Grayson meets Will Grayson. One cold night, in a most unlikely corner of Chicago, two strangers are about to cross paths. From that moment on, their world will collide and lives intertwine.It's not that far from Evanston to Naperville, but Chicago suburbanites Will Grayson and Will Grayson might as well live on different planets. When fate delivers them both to the same surprising crossroads, the Will Graysons find their lives overlapping and hurtling in new and unexpected directions. With a push from friends new and old - including the massive, and massively fabulous, Tiny Cooper, offensive lineman and musical theater auteur extraordinaire - Will and Will begin building toward respective romantic turns-of-heart and the epic production of history's most awesome high school musical. ...more",Young Adult
Where She Went (If I Stay #2),£41.73,In stock (5 available),4,"It's been three years since the devastating accident . . . three years since Mia walked out of Adam's life forever.Now living on opposite coasts, Mia is Juilliard's rising star and Adam is LA tabloid fodder, thanks to his new rock star status and celebrity girlfriend. When Adam gets stuck in New York by himself, chance brings the couple together again, for one last night. It's been three years since the devastating accident . . . three years since Mia walked out of Adam's life forever.Now living on opposite coasts, Mia is Juilliard's rising star and Adam is LA tabloid fodder, thanks to his new rock star status and celebrity girlfriend. When Adam gets stuck in New York by himself, chance brings the couple together again, for one last night. As they explore the city that has become Mia's home, Adam and Mia revisit the past and open their hearts to the future - and each other.Told from Adam's point of view in the spare, lyrical prose that defined If I Stay, Where She Went explores the devastation of grief, the promise of new hope, and the flame of rekindled romance. ...more",Young Adult
The Darkest Corners,£11.33,In stock (5 available),5,"The Darkest Corners is a psychological thriller about the lies little girls tell, and the deadly truths those lies become.There are ghosts around every corner in Fayette, Pennsylvania. Tessa left when she was nine and has been trying ever since not to think about it after what happened there that last summer. Memories of things so dark will burn themselves into your mind i The Darkest Corners is a psychological thriller about the lies little girls tell, and the deadly truths those lies become.There are ghosts around every corner in Fayette, Pennsylvania. Tessa left when she was nine and has been trying ever since not to think about it after what happened there that last summer. Memories of things so dark will burn themselves into your mind if you let them.Callie never left. She moved to another house, so she doesn’t have to walk those same halls, but then Callie always was the stronger one. She can handle staring into the faces of her demons—and if she parties hard enough, maybe one day they’ll disappear for good.Tessa and Callie have never talked about what they saw that night. After the trial, Callie drifted and Tessa moved, and childhood friends just have a way of losing touch.But ever since she left, Tessa has had questions. Things have never quite added up. And now she has to go back to Fayette—to Wyatt Stokes, sitting on death row; to Lori Cawley, Callie’s dead cousin; and to the one other person who may be hiding the truth.Only the closer Tessa gets to the truth, the closer she gets to a killer—and this time, it won’t be so easy to run away. ...more",Young Adult
Lola and the Boy Next Door (Anna and the French Kiss #2),£23.63,In stock (5 available),4,"Lola Nolan is a budding costume designer, and for her, the more outrageous, sparkly, and fun the outfit, the better. And everything is pretty perfect in her life (right down to her hot rocker boyfriend) until the Bell twins, Calliope and Cricket, return to the neighborhood. When Cricket, a gifted inventor, steps out from his twin sister's shadow and back into Lola's life, Lola Nolan is a budding costume designer, and for her, the more outrageous, sparkly, and fun the outfit, the better. And everything is pretty perfect in her life (right down to her hot rocker boyfriend) until the Bell twins, Calliope and Cricket, return to the neighborhood. When Cricket, a gifted inventor, steps out from his twin sister's shadow and back into Lola's life, she must finally reconcile a lifetime of feelings for the boy next door. ...more",Young Adult
Kill the Boy Band,£15.52,In stock (5 available),5,"Just know from the start that it wasn’t supposed to go like this. All we wanted was to get near them. That’s why we got a room in the hotel where they were staying.We were not planning to kidnap one of them. Especially not the most useless one. But we had him—his room key, his cell phone, and his secrets.We were not planning on what happened next.We swear.From thrilling ne Just know from the start that it wasn’t supposed to go like this. All we wanted was to get near them. That’s why we got a room in the hotel where they were staying.We were not planning to kidnap one of them. Especially not the most useless one. But we had him—his room key, his cell phone, and his secrets.We were not planning on what happened next.We swear.From thrilling new talent Goldy Moldavsky comes a pitch-black, hiarlious take on fandom and the badass girls who have the power to make—or break—the people we call “celebrities.” ...more",Young Adult
Isla and the Happily Ever After (Anna and the French Kiss #3),£48.13,In stock (5 available),5,"Love ignites in the City That Never Sleeps, but can it last? Hopeless romantic Isla has had a crush on introspective cartoonist Josh since their first year at the School of America in Paris. And after a chance encounter in Manhattan over the summer, romance might be closer than Isla imagined. But as they begin their senior year back in France, Isla and Josh are forced to c Love ignites in the City That Never Sleeps, but can it last? Hopeless romantic Isla has had a crush on introspective cartoonist Josh since their first year at the School of America in Paris. And after a chance encounter in Manhattan over the summer, romance might be closer than Isla imagined. But as they begin their senior year back in France, Isla and Josh are forced to confront the challenges every young couple must face, including family drama, uncertainty about their college futures, and the very real possibility of being apart. Featuring cameos from fan-favorites Anna, Étienne, Lola, and Cricket, this sweet and sexy story of true love—set against the stunning backdrops of New York City, Paris, and Barcelona—is a swoonworthy conclusion to Stephanie Perkins’s beloved series. ...more",Young Adult
