title,price,availability,star_rating,description,category
10-Day Green Smoothie Cleanse: Lose Up to 15 Pounds in 10 Days!,£49.71,In stock (10 available),5,"The 10-Day Green Smoothie Cleanse will jump-start your weight loss, increase your energy level, clear your mind, and improve your overall health. Made up of supernutrients from leafy greens and fruits, green smoothies are filling and healthy and you will enjoy drinking them. Your body will also thank you for drinking them as your health and energy improve to levels you nev The 10-Day Green Smoothie Cleanse will jump-start your weight loss, increase your energy level, clear your mind, and improve your overall health. Made up of supernutrients from leafy greens and fruits, green smoothies are filling and healthy and you will enjoy drinking them. Your body will also thank you for drinking them as your health and energy improve to levels you never thought possible. In ten days, you can expect to lose weight, reduce cravings, clear your mind, and improve digestion. It is an experience that could change your life if you stick with it! This book provides a shopping list, recipes, and detailed instructions for the 10-day cleanse, along with suggestions for getting the best results. It also offers advice on how to continue to lose weight and maintain good health afterwards. Are you ready to look slimmer, healthier, and sexier than you have in years? Then get ready to begin the 10-Day Green Smoothie Cleanse! If you successfully complete the 10-Day Green Smoothie Cleanse, you will… - Lose 10‒15 pounds in 10 days - Get rid of stubborn body fat, including belly fat - Drop pounds and inches fast, without grueling workouts - Learn to live a healthier lifestyle of detoxing and healthy eating - Help your body naturally crave healthy foods so you never have to diet again - Receive over 100 green smoothie recipes for various health conditions and goals JJ Smith is the author of the #1 national bestseller and USA Today bestseller Lose Weight Without Dieting or Working Out! JJ Smith is a nutritionist and certified weight-loss expert who has been featured on The Steve Harvey Show, The Montel Williams Show, and The Jamie Foxx Show and on the NBC, FOX, and CW Network television stations, as well as in the pages of Glamour, Essence, and Ladies Home Journal. Since reclaiming her health, losing weight, and discovering a “second youth” in her forties, JJ has become the voice of inspiration to those who want to lose weight, be healthy, and get their sexy back! ...more",Health
The Art and Science of Low Carbohydrate Living,£52.98,In stock (9 available),5,"The Art And Science Of Low Carbohydrate Living: An Expert Guide To Making The Life-Saving Benefits Of Carbohydrate Restriction Sustainable And EnjoyableCarbohydrate restricted diets are commonly practiced but seldom taught. As a result, doctors, dietitians, nutritionists, and nurses may have strong opinions about low carbohydrate dieting, but in many if not most cases, the The Art And Science Of Low Carbohydrate Living: An Expert Guide To Making The Life-Saving Benefits Of Carbohydrate Restriction Sustainable And EnjoyableCarbohydrate restricted diets are commonly practiced but seldom taught. As a result, doctors, dietitians, nutritionists, and nurses may have strong opinions about low carbohydrate dieting, but in many if not most cases, these views are not grounded in science.Now, whether you are a curious healthcare professional or just a connoisseur of diet information, two New York Times best-selling authors provide you with the definitive resource for low carbohydrate living. Doctors Volek and Phinney share over 50 years of clinical experience using low carbohydrate diets, and together they have published more than 200 research papers and chapters on the topic. Particularly in the last decade, much has been learned about the risks associated with insulin resistance (including but not limited to metabolic synd ...more",Health
Scott Pilgrim's Precious Little Life (Scott Pilgrim #1),£52.29,In stock (19 available),5,"Scott Pilgrim's life is totally sweet. He's 23 years old, he's in a rockband, he's ""between jobs"" and he's dating a cute high school girl. Nothing could possibly go wrong, unless a seriously mind-blowing, dangerously fashionable, rollerblading delivery girl named Ramona Flowers starts cruising through his dreams and sailing by him at parties. Will Scott's awesome life get Scott Pilgrim's life is totally sweet. He's 23 years old, he's in a rockband, he's ""between jobs"" and he's dating a cute high school girl. Nothing could possibly go wrong, unless a seriously mind-blowing, dangerously fashionable, rollerblading delivery girl named Ramona Flowers starts cruising through his dreams and sailing by him at parties. Will Scott's awesome life get turned upside-down? Will he have to face Ramona's seven evil ex-boyfriends in battle? The short answer is yes. The long answer is Scott Pilgrim, Volume 1: Scott Pilgrim's Precious Little Life ...more",Sequential Art
This One Summer,£19.49,In stock (16 available),4,"Every summer, Rose goes with her mom and dad to a lake house in Awago Beach. It's their getaway, their refuge. Rosie's friend Windy is always there, too, like the little sister she never had. But this summer is different. Rose's mom and dad won't stop fighting, and when Rose and Windy seek a distraction from the drama, they find themselves with a whole new set of problems. Every summer, Rose goes with her mom and dad to a lake house in Awago Beach. It's their getaway, their refuge. Rosie's friend Windy is always there, too, like the little sister she never had. But this summer is different. Rose's mom and dad won't stop fighting, and when Rose and Windy seek a distraction from the drama, they find themselves with a whole new set of problems. It's a summer of secrets and sorrow and growing up, and it's a good thing Rose and Windy have each other.In This One Summer two stellar creators redefine the teen graphic novel. Cousins Mariko and Jillian Tamaki, the team behind Skim, have collaborated on this gorgeous, heartbreaking, and ultimately hopeful story about a girl on the cusp of her teen age — a story of renewal and revelation. ...more",Sequential Art
The Nameless City (The Nameless City #1),£38.16,In stock (16 available),4,"Every nation that invades the City gives it a new name. But before long, new invaders arrive and the City changes hands once again. The natives don't let themselves get caught up in the unending wars. To them, their home is the Nameless City, and those who try to name it are forever outsiders.Kaidu is one such outsider. He's a Dao born and bred--a member of the latest occu Every nation that invades the City gives it a new name. But before long, new invaders arrive and the City changes hands once again. The natives don't let themselves get caught up in the unending wars. To them, their home is the Nameless City, and those who try to name it are forever outsiders.Kaidu is one such outsider. He's a Dao born and bred--a member of the latest occupying nation. Rat is a native of the Nameless City. At first, she hates Kai for everything he stands for, but his love of his new home may be the one thing that can bring these two unlikely friends together. Let's hope so, because the fate of the Nameless City rests in their hands. ...more",Sequential Art
"Princess Jellyfish 2-in-1 Omnibus, Vol. 01 (Princess Jellyfish 2-in-1 Omnibus #1)",£13.61,In stock (16 available),5,"THE LONG-AWAITED STORY OF FANGIRLS TAKING ON TOKYO!Special large-size 2-in-1 edition of over 400 pages!""One of the best anime and manga for beginners. Enthusiasm - geeky and otherwise - is power in Princess Jellyfish. Enthusiasm saves the day and paves the road to the future."" - Kotaku""Princess Jellyfish's ambition is simple: to tell a delightful story in a delightful way. THE LONG-AWAITED STORY OF FANGIRLS TAKING ON TOKYO!Special large-size 2-in-1 edition of over 400 pages!""One of the best anime and manga for beginners. Enthusiasm - geeky and otherwise - is power in Princess Jellyfish. Enthusiasm saves the day and paves the road to the future."" - Kotaku""Princess Jellyfish's ambition is simple: to tell a delightful story in a delightful way... It's a pretty deadly one-two punch."" - Anime News Network""Loaded with heart, soul, humor and insight."" - About.comSTINGING BEAUTY Tsukimi Kurashita has a strange fascination with jellyfish. She’s loved them from a young age and has carried that love with her to her new life in the big city of Tokyo. There, she resides in Amamizukan, a safe-haven for girl geeks who regularly gush over a range of things from trains to Japanese dolls. However, a chance meeting at a pet shop has Tsukimi crossing paths with one of the things that the residents of Amamizukan have been desperately trying to avoid—a beautiful and fashionable woman! But there’s much more to this woman than her trendy clothes! This odd encounter is only the beginning of a new and unexpected path for Tsukimi and her friends. ...more",Sequential Art
"Outcast, Vol. 1: A Darkness Surrounds Him (Outcast #1)",£15.44,In stock (16 available),4,"NEW HORROR SERIES FROM THE WALKING DEAD CREATOR ROBERT KIRKMAN! Kyle Barnes has been plagued by demonic possession all his life and now he needs answers. Unfortunately, what he uncovers along the way could bring about the end of life on Earth as we know it. Collects OUTCAST BY KIRKMAN & AZACETA #1-6.",Sequential Art
Danganronpa Volume 1,£51.99,In stock (16 available),4,"Each year, the elite Hope's Peak Academy selects only the most gifted and talented students to enroll...plus one ordinary student, chosen by lottery. Makoto Naegi was that lucky person--or so he thought! When he shows up for class, he finds the elite students are a bizarre cast of oddballs under the ruthless authority of a robot teddy bear principal, Monokuma. The bear lay Each year, the elite Hope's Peak Academy selects only the most gifted and talented students to enroll...plus one ordinary student, chosen by lottery. Makoto Naegi was that lucky person--or so he thought! When he shows up for class, he finds the elite students are a bizarre cast of oddballs under the ruthless authority of a robot teddy bear principal, Monokuma. The bear lays down the school rules: the only way out of Hope's Peak is to not only murder another student...but get away with it, as every murder is followed by a tribunal where the surviving students cross-examine each other!Inspired by the Danganronpa videogame series and based on the anime of the same name, the Danganropa manga is a quirky, fun, weird, and dynamic take on the high school Battle Royale genre. ...more",Sequential Art
"Codename Baboushka, Volume 1: The Conclave of Death",£36.72,In stock (16 available),4,"""What if the sexy Russian femme fatale was actually the main character?"" Mysterious young heiress Contessa Annika Malikova has been part of Manhattan high society for several years... but if they knew the truth, her dinner companions would faint! The white-haired Contessa is in fact the notorious criminal ""BABOUSHKA"" -- a former Moscow gang leader, now living in exile! But ""What if the sexy Russian femme fatale was actually the main character?"" Mysterious young heiress Contessa Annika Malikova has been part of Manhattan high society for several years... but if they knew the truth, her dinner companions would faint! The white-haired Contessa is in fact the notorious criminal ""BABOUSHKA"" -- a former Moscow gang leader, now living in exile! But Baboushka's retirement is about to be shattered, as the US government has somehow discovered her true identity, and blackmails her into working for them! Now she must infiltrate a secret conclave of global crime lords, on a cruise liner, to retrieve information for the Americans. But nobody reckoned on the boat being hijacked by pirates... Suitable for teens and up, CODENAME BABOUSHKA is an action-packed modern pulp spy thriller from writer ANTONY JOHNSTON (THE FUSE, THE COLDEST CITY, ALEX RIDER) and artist SHARI CHANKHAMMA (THE FUSE, SHELTERED, KILL SHAKESPEARE), filled with glamour, guns, exotic locations, guns, explosions, high-kicks, and did we mention guns? ""An ass-kicking spy heroine who will appeal to fans of Marvel's Black Widow.""- The AV Club ""There are literally six different amazing comics all within this one series""- Comics Alliance ""Codename Baboushka takes a more female-positive look at the James Bond-esque role. Fun, fast-paced action. Female assassin done right!""- Dark Side Comics ""Johnston's exiled Russian heiress, former organized crime lord and deadly agent bursts out of the page and grabs the reader with both hands in a deadly grip of hot action and cold-hearted kills.""- Jersey Journal THE CONCLAVE OF DEATH collects Baboushka's first 5-issue mission -- watch out for her next assignment, GHOST STATION ZERO, in 2016! ""Antony Johnston is an award-winning, New York Times bestselling author of graphic novels, video games, and books. His graphic novel THE COLDEST CITY is being adapted into a film starring Charlize Theron. His epic series WASTELAND is one of only a handful of such longform comic stories in the medium. His first video game, DEAD SPACE, redefined the survival horror genre. ...more",Sequential Art
Camp Midnight,£17.08,In stock (16 available),4,"Ben 10 and Big Hero 6 creator Steven T. Seagle returns to comics with New Yorker Magazine cartoonist Jason Adam Katzenstein for a new graphic novel! Reluctant Skye is accidentally sent to the wrong summer camp. Not wanting to please her ""step monster,"" Skye is dead-set on not fitting in. That won't be a problem, as everyone at Camp Midnight-with the exception of fellow cam Ben 10 and Big Hero 6 creator Steven T. Seagle returns to comics with New Yorker Magazine cartoonist Jason Adam Katzenstein for a new graphic novel! Reluctant Skye is accidentally sent to the wrong summer camp. Not wanting to please her ""step monster,"" Skye is dead-set on not fitting in. That won't be a problem, as everyone at Camp Midnight-with the exception of fellow camper and fast-friend Mia-is a full-fledged monster! The perfect book for fans of Raina Telgemeier's ""Smile, "" but wish it had more bowls of gooey eyeballs. ...more",Sequential Art
"Fables, Vol. 1: Legends in Exile (Fables #1)",£41.62,In stock (15 available),4,"When a savage creature known only as the Adversary conquered the fabled lands of legends and fairy tales, all of the infamous inhabitants of folklore were forced into exile. Disguised among the normal citizens of modern-day New York, these magical characters have created their own peaceful and secret society within an exclusive luxury apartment building called Fabletown. B When a savage creature known only as the Adversary conquered the fabled lands of legends and fairy tales, all of the infamous inhabitants of folklore were forced into exile. Disguised among the normal citizens of modern-day New York, these magical characters have created their own peaceful and secret society within an exclusive luxury apartment building called Fabletown. But when Snow White's party-girl sister, Rose Red, is apparently murdered, it is up to Fabletown's sheriff, a reformed and pardoned Big Bad Wolf (Bigby Wolf), to determine if the killer is Bluebeard, Rose's ex-lover and notorious wife killer, or Jack, her current live-in boyfriend and former beanstalk-climber.Collecting FABLES #1-5. ...more",Sequential Art
Batman: The Dark Knight Returns (Batman),£15.38,In stock (15 available),5,"This masterpiece of modern comics storytelling brings to vivid life a dark world and an even darker man. Together with inker Klaus Janson and colorist Lynn Varley, writer/artist Frank Miller completely reinvents the legend of Batman in his saga of a near-future Gotham City gone to rot, ten years after the Dark Knight's retirement. Crime runs rampant in the streets, and the This masterpiece of modern comics storytelling brings to vivid life a dark world and an even darker man. Together with inker Klaus Janson and colorist Lynn Varley, writer/artist Frank Miller completely reinvents the legend of Batman in his saga of a near-future Gotham City gone to rot, ten years after the Dark Knight's retirement. Crime runs rampant in the streets, and the man who was Batman is still tortured by the memories of his parents' murders. As civil society crumbles around him, Bruce Wayne's long-suppressed vigilante side finally breaks free of its self-imposed shackles. The Dark Knight returns in a blaze of fury, taking on a whole new generation of criminals and matching their level of violence. He is soon joined by this generation's Robin — a girl named Carrie Kelley, who proves to be just as invaluable as her predecessors.But can Batman and Robin deal with the threat posed by their deadliest enemies, after years of incarceration have made them into perfect psychopaths? And more important, can anyone survive the coming fallout of an undeclared war between the superpowers - or a clash of what were once the world's greatest superheroes?Over fifteen years after its debut, 'Batman: The Dark Knight Returns' remains an undisputed classic and one of the most influential stories ever told in the comics medium.Collecting BATMAN: THE DARK KNIGHT RETURNS #1-4 ...more",Sequential Art
"Wonder Woman: Earth One, Volume One (Wonder Woman: Earth One #1)",£37.34,In stock (14 available),4,"Following the New York Times #1 bestselling original graphic novels Batman: Earth One, Volume One and Superman: Earth One Volumes One and Two comes Wonder Woman: Earth One, Volume One!Critically acclaimed, best-selling writer Grant Morrison (All-Star Superman, Batman, Inc.) once again pushes the boundaries of the graphic novel page in his mind-bending new take on the most Following the New York Times #1 bestselling original graphic novels Batman: Earth One, Volume One and Superman: Earth One Volumes One and Two comes Wonder Woman: Earth One, Volume One!Critically acclaimed, best-selling writer Grant Morrison (All-Star Superman, Batman, Inc.) once again pushes the boundaries of the graphic novel page in his mind-bending new take on the most powerful woman in the DC Universe. With stunning art by Yanick Paquette (Swamp Thing), Wonder Woman: Earth One, Volume One is an easily accessible jumping on point for new readers. ...more",Sequential Art
Superman Vol. 1: Before Truth (Superman by Gene Luen Yang #1),£11.89,In stock (14 available),5,"Superman is going through some changes. First, there's his new ""solar flare"" power, which releases tremendous amounts of energy but leaves him functionally human - fragile, vulnerable, prone to hangovers - for 24 hours.But an even bigger change is coming. A new company called Hordr has sprung up, and its business is secrets. If you have one that you want to keep hidden, Hr Superman is going through some changes. First, there's his new ""solar flare"" power, which releases tremendous amounts of energy but leaves him functionally human - fragile, vulnerable, prone to hangovers - for 24 hours.But an even bigger change is coming. A new company called Hordr has sprung up, and its business is secrets. If you have one that you want to keep hidden, Hrdr can control you - and no one has a bigger secret than Clark Kent.Now, Hordr is threatening to expose Clark's alter ego unless he does everything they command. Will Superman play into the hands of blackmailers to keep his loved ones out of danger? And if the truth that Superman has been hiding is exposed, will it set him free - or ruin his life?A new era for the Man of Steel begins here - crafted by National Book Award nominee Gene Luen Yang (American Born Chinese) and legendary artists John Romita Jr. (Kick-Ass, The Amazing Spider-Man) and Klaus Janson (BATMAN: THE DARK KNIGHT RETURNS). Collects issues #40-44 and the 8-page Superman story from DIVERGENCE: FCBD SPECIAL EDITION #1. ...more",Sequential Art
"So Cute It Hurts!!, Vol. 6 (So Cute It Hurts!! #6)",£35.43,In stock (14 available),4,"The Kobayashi twins, Megumu and Mitsuru, were named after historical figures, but only Megumu has grown up with a taste for history. So when Mitsuru is in danger of losing his weekends to extra history classes, he convinces his sister to swap clothes with him and ace his tests! After all, how hard can it be for them to play each other?Megumu is considering a career as a ma The Kobayashi twins, Megumu and Mitsuru, were named after historical figures, but only Megumu has grown up with a taste for history. So when Mitsuru is in danger of losing his weekends to extra history classes, he convinces his sister to swap clothes with him and ace his tests! After all, how hard can it be for them to play each other?Megumu is considering a career as a manga artist, but as Mitsuru so helpfully points out, her drawing skills could use a lot of improvement. That doesn’t dim her enthusiasm, and she vows to practice drawing every day. But her first sketching session in a park is interrupted by an intense young man who goes ballistic when he sees the portrait of Aoi in her sketchbook! Who is this stranger, and why does he want to destroy her boyfriend?! ...more",Sequential Art
El Deafo,£57.62,In stock (14 available),5,"Starting at a new school is scary, even more so with a giant hearing aid strapped to your chest! At her old school, everyone in Cece's class was deaf. Here she is different. She is sure the kids are staring at the Phonic Ear, the powerful aid that will help her hear her teacher. Too bad it also seems certain to repel potential friends. Then Cece makes a startling discovery Starting at a new school is scary, even more so with a giant hearing aid strapped to your chest! At her old school, everyone in Cece's class was deaf. Here she is different. She is sure the kids are staring at the Phonic Ear, the powerful aid that will help her hear her teacher. Too bad it also seems certain to repel potential friends. Then Cece makes a startling discovery. With the Phonic Ear she can hear her teacher not just in the classroom, but anywhere her teacher is in school--in the hallway...in the teacher's lounge...in the bathroom! This is power. Maybe even superpower! Cece is on her way to becoming El Deafo, Listener for All. But the funny thing about being a superhero is that it's just another way of feeling different... and lonely. Can Cece channel her powers into finding the thing she wants most, a true friend?This funny perceptive graphic novel memoir about growing up hearing impaired is also an unforgettable book about growing up, and all the super and super embarrassing moments along the way. ...more",Sequential Art
"Fruits Basket, Vol. 9 (Fruits Basket #9)",£33.95,In stock (9 available),4,"Finally - summer has arrived! While Tohru struggles through bipolar days of hope and anxiety, what will happen when Yuki comes face-to-face with the new member of the student council? Meanwhile, who is that Uo-chan's hanging out with? Is she c-r-a-z-y in love? In a bonus feature, Hana-chan's past is finally disclosed!",Sequential Art
Roller Girl,£14.10,In stock (8 available),5,"For fans of Raina Telgemeier’s Smile, a heartwarming graphic novel about friendship and surviving junior high through the power of roller derby. Twelve-year-old Astrid has always done everything with her best friend Nicole. So when Astrid signs up for roller derby camp, she assumes Nicole will too. But Nicole signs up for dance camp with a new friend instead, and so begins For fans of Raina Telgemeier’s Smile, a heartwarming graphic novel about friendship and surviving junior high through the power of roller derby. Twelve-year-old Astrid has always done everything with her best friend Nicole. So when Astrid signs up for roller derby camp, she assumes Nicole will too. But Nicole signs up for dance camp with a new friend instead, and so begins the toughest summer of Astrid's life. There are bumps and bruises as Astrid learns who she is without Nicole...and what it takes to be a strong, tough roller girl. ...more",Sequential Art
"Fruits Basket, Vol. 6 (Fruits Basket #6)",£20.96,In stock (6 available),4,"Delving into the recesses of Kyo's past, we find the Sohma trio returning home on a rainy day. There, a mysterious man who has known Kyo for a long time meets them. Trust, loyalty and the bonds of family and friendship are tested, as Tohru must help Kyo deal with the ""monsters"" that he's been trying to avoid.",Sequential Art
"Fruits Basket, Vol. 4 (Fruits Basket #4)",£50.44,In stock (4 available),4,"When the infamous Akito makes an in-class appearance at the start of the school year, the Sohma family worries that his arrival will be an uncensored exercise of show-and-tell about Yuki's past. Meanwhile, when Ayame vows to rekindle his brother's lost friendship, he begins to realize that you can choose your friends but you can't choose your family - especially when they' When the infamous Akito makes an in-class appearance at the start of the school year, the Sohma family worries that his arrival will be an uncensored exercise of show-and-tell about Yuki's past. Meanwhile, when Ayame vows to rekindle his brother's lost friendship, he begins to realize that you can choose your friends but you can't choose your family - especially when they're acting like animals! ...more",Sequential Art
